{
  "schema_version": "2026-02-20.run-meta-packet.v1",
  "record_kind": "run_meta_packet",
  "run_packet_id": "sha256:27c2a69dc0302e313cffc7e6ec4eee2bdd9015396837f94dacd78319932685a5",
  "run_id": "run-schema-sample-001",
  "category": "mouse",
  "started_at": "2026-02-20T11:32:55.212Z",
  "finished_at": "2026-02-20T11:32:56.712Z",
  "duration_ms": 1500,
  "trigger": "manual",
  "execution_summary": {
    "item_total": 1,
    "item_succeeded": 1,
    "item_partial": 0,
    "item_failed": 0,
    "source_total": 1,
    "source_fetched": 1,
    "source_failed": 0,
    "assertion_total": 1,
    "evidence_total": 1,
    "identity_rejected_evidence_total": 0
  },
  "phase_summary": {
    "extract:static-html": {
      "enabled": true,
      "executed_sources": 0,
      "assertion_count": 0,
      "evidence_count": 0,
      "error_count": 0,
      "duration_ms": 0
    },
    "extract:dynamic-js": {
      "enabled": true,
      "executed_sources": 0,
      "assertion_count": 0,
      "evidence_count": 0,
      "error_count": 0,
      "duration_ms": 0
    },
    "extract:article-text": {
      "enabled": true,
      "executed_sources": 0,
      "assertion_count": 0,
      "evidence_count": 0,
      "error_count": 0,
      "duration_ms": 0
    },
    "extract:html-table": {
      "enabled": true,
      "executed_sources": 0,
      "assertion_count": 0,
      "evidence_count": 0,
      "error_count": 0,
      "duration_ms": 0
    },
    "extract:structured-meta": {
      "enabled": true,
      "executed_sources": 1,
      "assertion_count": 1,
      "evidence_count": 1,
      "error_count": 0,
      "duration_ms": 0
    },
    "extract:text-pdf": {
      "enabled": true,
      "executed_sources": 0,
      "assertion_count": 0,
      "evidence_count": 0,
      "error_count": 0,
      "duration_ms": 0
    },
    "extract:scanned-pdf-ocr": {
      "enabled": true,
      "executed_sources": 0,
      "assertion_count": 0,
      "evidence_count": 0,
      "error_count": 0,
      "duration_ms": 0
    },
    "extract:image-ocr": {
      "enabled": true,
      "executed_sources": 0,
      "assertion_count": 0,
      "evidence_count": 0,
      "error_count": 0,
      "duration_ms": 0
    },
    "extract:chart-graph": {
      "enabled": true,
      "executed_sources": 0,
      "assertion_count": 0,
      "evidence_count": 0,
      "error_count": 0,
      "duration_ms": 0
    },
    "extract:office-doc": {
      "enabled": true,
      "executed_sources": 0,
      "assertion_count": 0,
      "evidence_count": 0,
      "error_count": 0,
      "duration_ms": 0
    }
  },
  "output_refs": {
    "source_packet_refs": [
      {
        "source_packet_id": "sha256:6359d1df3c08c3cec9b7ac21d245fc410c79dfc828362e1a1c21fc539dde8973",
        "source_version_id": "sha256:e011e4afd9eb48fc92978bccda740a1f73aa526a1ed67aa5984e870feab4b448",
        "source_id": "src_f0309b6b89cb"
      }
    ],
    "item_packet_refs": [
      {
        "item_packet_id": "sha256:8c46c0d81f420acd4df90f65f96f0d929c817f9672a5e19c7bc056ff2984d8bd",
        "item_identifier": "mouse-logitech-g-pro-x-superlight-2"
      }
    ],
    "manifest_paths": [],
    "visual_manifest_paths": []
  },
  "quality_gates": {
    "coverage_gate_passed": true,
    "evidence_gate_passed": true,
    "error_rate_gate_passed": true,
    "target_match_gate_passed": true,
    "target_match_pass_ratio": 1,
    "coverage_ratio": 0.92,
    "error_ratio": 0
  },
  "pipeline_config": {
    "phase08_batch_count": 1
  }
}
